	name	place_id	types	geometry.location.lat	geometry.location.lng	opening_hours.open_now	formatted_address	main_type
0	Residencia binary hub	ChIJ72zqlzoMZ0gR8Mt9hVsscVg	school|point_of_interest|establishment	53.3435737	-6.283920900000001			school
1	Learning Studio	ChIJVVUVpzoMZ0gRU61JUaER2F8	school|point_of_interest|establishment	53.3441915	-6.283309599999999			school
2	The Academy of Code	ChIJsc-_vjoMZ0gRRnj5mDFIIXc	school|point_of_interest|establishment	53.34318949999999	-6.2832873	False		school
3	NCAD ANNEX	ChIJJxBHczoMZ0gRWjuUpeOb2Uo	school|point_of_interest|establishment	53.3436579	-6.2871772			school
4	ttrch5	ChIJE8p_kQMNZ0gR71O-wwWyuhE	school|point_of_interest|establishment	53.34539009999999	-6.287223399999999			school
5	CMS Learning Centre	ChIJPTG3SCUMZ0gRagT2WK1_vBY	school|point_of_interest|establishment	53.3446082	-6.280998299999999			school
6	Saint Catherines Primary School	ChIJXSkw1joMZ0gR5BNQjuv4REw	primary_school|school|point_of_interest|establishment	53.3415757	-6.2828168			school
7	Early Days Creche	ChIJmyrFIDsMZ0gREn9JNdnAEsE	school|point_of_interest|establishment	53.34155740000001	-6.2821157			school
8	Little Red Edu	ChIJUzl1lcENZ0gRhaMzQ47tIgk	school|point_of_interest|store|establishment	53.34106269999999	-6.283866400000001			school
9	District School	ChIJBR4bJzsMZ0gRtwYUnh8A0EA	school|point_of_interest|establishment	53.34082599999999	-6.283047299999999			school
10	Bass Guitar/Acoustic Guitar Lessons Dublin	ChIJGW8jelcNZ0gRgoQj2ai4Dcs	school|point_of_interest|establishment	53.3474324	-6.2829215			school
11	Bass Guitar/Acoustic Guitar Lessons Dublin	ChIJU81CAbQNZ0gRGrn-7l8h6CM	school|point_of_interest|establishment	53.3474324	-6.2829215	True		school
12	Honor Nursery & Montessori	ChIJ9QNfWKYJZ0gRvbouPcIN0Oo	school|point_of_interest|establishment	53.3467475	-6.280739599999999	False		school
13	Marys Convent Rathfarm , Saplings Special, Scool	ChIJTQh1Mi4MZ0gRvfDu8iLpybQ	school|point_of_interest|establishment	53.3473012	-6.281927400000001			school
14	Dublin Steiner School	ChIJv9bxDyUMZ0gRv3hGGLwH2-I	school|point_of_interest|establishment	53.34250489999999	-6.278980699999999	False		school
15	Liberty Creche	ChIJ13XLGiUMZ0gR5Isb0DlHb0g	school|point_of_interest|establishment	53.34241470000001	-6.2789283			school
16	Lir Training and Education Ireland	ChIJ97HGHCUMZ0gRGrXSt2f5RFs	school|point_of_interest|establishment	53.3420147	-6.279172499999999			school
17	Career Guidance	ChIJTfk7CCUMZ0gRKw911qf8e7M	school|point_of_interest|establishment	53.3426157	-6.2783041			school
18	Someone Like Me Art Competition	ChIJf092Di8MZ0gR_8Mg-p-EbJM	school|point_of_interest|establishment	53.3460644	-6.2784421			school
19	CBS James Street	ChIJz2GlbzkMZ0gRjAlaO-2MSNc	school|point_of_interest|establishment	53.3404405	-6.28931			school
20	Mater Dei National School	ChIJp-xDczkMZ0gR87kLOedhxWM	primary_school|school|point_of_interest|establishment	53.3408165	-6.290026699999999		Basin Lane, James Street, Dublin	school
21	Christian Brothers Secondary School	ChIJATfybjkMZ0gRFHm7U5ImA40	school|point_of_interest|establishment	53.3403572	-6.289401		Basin View, The Liberties, Dublin 8	school
22	Scoil Seamus CBS	ChIJYW9eMzgMZ0gRGHQkfK-Tmp0	school|point_of_interest|establishment	53.3405867	-6.2898811		James St, The Liberties, Dublin	school
23	St. James's Primary School	ChIJDY3IdDkMZ0gRdTTOp44hprw	school|point_of_interest|establishment	53.3403792	-6.2898805		Basin View, Ushers, Dublin	school
24	Canal Way Educate Together National School	ChIJE_4_QjkMZ0gRGjlJfE0gclI	school|point_of_interest|establishment	53.3399158	-6.289456899999999		Basin Lane, The Liberties, Dublin 8, D08 R125	school
25	Polish School of English in Dublin	ChIJTa6y8CUMZ0gRC_Oz_roigGw	school|point_of_interest|establishment	53.34442989999999	-6.2759762		28 Lower Bridge St, The Liberties, Dublin	school
26	Escola	ChIJjU-GHM0NZ0gRAO4abdSsdhM	school|point_of_interest|establishment	53.3416931	-6.275684399999999		1 Swift's Alley, Merchants Quay, Dublin 8	school
28	Francis Street School	ChIJ48fUJiQMZ0gRUbzq0Ev9aUA	primary_school|school|point_of_interest|establishment	53.3414075	-6.2734884		John Dillon St, The Liberties, Dublin 8, D08 FE83	school
29	St Brigid’s Catholic Primary School	ChIJ92Bh-SMMZ0gRt-F9IDO02_A	primary_school|school|point_of_interest|establishment	53.3389068	-6.2749714		The Coombe, The Liberties, Dublin	school
30	St Pauls CBS Secondary School	ChIJZfp7ACwMZ0gRKLYh_v1GL-w	school|point_of_interest|establishment	53.35019800000001	-6.2764808		Brunswick St N, Dublin, D07 VF57	school
31	Stanhope Street Primary School	ChIJxekkUywMZ0gRzEHv_n2rvoE	primary_school|school|point_of_interest|establishment	53.35264	-6.282912899999999	False	Manor St, Stoneybatter, Dublin 7, D07 DY60	school
32	Stanhope Street Girls (St. Joseph's) Secondary School	ChIJS9NxmC0MZ0gR2r8cHtI3FJ0	secondary_school|school|point_of_interest|establishment	53.3526032	-6.2818973	False	7 Stanhope St, Stoneybatter, Dublin 7, D07 W0Y0	school
33	Dublin 7 Educate Together National School	ChIJz1477CwMZ0gRvyG8ZqJLpBk	primary_school|school|point_of_interest|establishment	53.3518786	-6.277930700000001		Fitzwilliam Pl N, Arran Quay, Dublin 7	school
34	Warrenmount Primary School	ChIJ-1e7rSMMZ0gRJ-DzVD4w6fI	school|point_of_interest|establishment	53.3367435	-6.2761331		25-26, Blackpitts, Merchants Quay, Dublin, D08 XR62	school
35	Presentation Primary School George’s Hill	ChIJRyjUoikMZ0gREJt45XTCg_I	primary_school|school|point_of_interest|establishment	53.3483489	-6.271549299999999		Halston St, Dublin 7	school
36	Presentation Secondary School, Warrenmount	ChIJj0kt9iIMZ0gRPkbRxEeuTms	secondary_school|school|point_of_interest|establishment	53.33597719999999	-6.2778127		Clarence Mangan Rd, Warrenmount, Dublin 8, D08 W0X7	school
37	St. Patrick's Cathedral Grammar School	ChIJhwYhMSEMZ0gRpW3MaWasXpw	school|point_of_interest|establishment	53.33888	-6.272200799999999		St Patrick's Close, Dublin	school
38	Educate Together	ChIJb-OcipMOZ0gRvHaxmlFPuWM	school|secondary_school|point_of_interest|establishment	53.34602599999999	-6.2697663	False	Equity House, 16/17 Ormond Quay Upper, North City, Dublin, D07 H7DE	school
39	School Of English	ChIJFeHaUCQNZ0gR_C1AuTDP-n8	school|point_of_interest|establishment	53.3475122	-6.2693943		4 Meetinghouse Ln, Smithfield, Dublin 7, D07 VY06	school
40	Muhammed School	ChIJA7pERiIMZ0gRV5X5996ahjY	school|point_of_interest|establishment	53.3357795	-6.2752399		12 Warrenmount Pl, Dublin 8	school
41	Scoil Treasa Naofa	ChIJC_GNrCIMZ0gRbRHxSlj85hA	school|point_of_interest|establishment	53.3345001	-6.279277899999999	False	Petrie Rd, Donore Avenue, Dublin 8	school
42	High Schools International Limited	ChIJWeWJTZ0OZ0gRulImyVpELvU	school|point_of_interest|establishment	53.34489050000001	-6.2672447		Castle River House, Parliament St, Temple Bar, Dublin	school
43	St. Gabriels National School Stoneybatter	ChIJ5_UDWzMMZ0gRBOeEIWjlq3k	school|point_of_interest|establishment	53.3538988	-6.290424300000001		Cowper St, Arbour Hill, Stoneybatter, Dublin 7	school
44	The Internacional School Of English	ChIJf2kQ8aENZ0gRkx6VTwdxOBg	school|point_of_interest|establishment	53.3496951	-6.2694601		106 Capel St, Rotunda, Dublin 1, D01 WY40	school
45	St Catherine's National School	ChIJe9CcLBYMZ0gRbcGsTeBmAgE	school|point_of_interest|establishment	53.33322279999999	-6.283084199999999		8 Donore Ave, S Circular Rd, Dublin	school
46	St Endas Primary School	ChIJ2-lz-p0OZ0gRBZvq0u_C8uE	school|point_of_interest|establishment	53.340396	-6.266591		Whitefriar Pl, Dublin 8	school
48	School	ChIJ90_vjm4PZ0gRqbONQq4Z6FM	school|point_of_interest|establishment	53.3385873	-6.2663633		8 Peter Row, Dublin	school
49	Henrietta Street School	ChIJBYJneyoMZ0gR7eSK6ONk5Cs	school|point_of_interest|establishment	53.3527972	-6.270403200000001	False	8 Henrietta St, Dublin 1, D01 W825	school
50	Irish Boarding Schools	ChIJc-IPYh8MZ0gRCe4WNOw35To	secondary_school|school|point_of_interest|establishment	53.3340427	-6.272765499999999		Lombard St W, Portobello, Dublin, D08 P8C4	school
51	School	ChIJkWe_SZwOZ0gRNdlhMGLRae4	school|point_of_interest|establishment	53.3413522	-6.2633015		33 William St S, Dublin 2, D02 NC58	school
52	Christian Brothers Secondary School	ChIJY0yM6x8MZ0gRaNcO_-4tkWs	secondary_school|school|point_of_interest|establishment	53.3335738	-6.2681098		Synge St, Saint Kevin's, Dublin	school
53	The International School of English	ChIJN-SQhjAPZ0gRgH6DtHxXDgE	school|point_of_interest|establishment	53.3346539	-6.2655514	False	66 Camden Street Lower, Saint Kevin's, Dublin, D02 X201	school
54	St Mary's Primary School	ChIJzZylZoAOZ0gRTLBOQHt4LDg	school|point_of_interest|establishment	53.3547906	-6.267343200000001	False	Paradise Pl, Phibsborough, Dublin 7	school
55	Bunscoil Sancta Maria (ERST) Primary School	ChIJY0yM6x8MZ0gRjYeXz_cfco8	school|point_of_interest|establishment	53.3333652	-6.2671031		Synge St, Saint Kevin's, Dublin	school
56	International School of Dublin	ChIJF_qvXsAIZ0gRdQQxcmsGssc	primary_school|school|point_of_interest|establishment	53.3332948	-6.2670762	False	Synge St, Saint Kevin's, Dublin, D08 PW64	school
57	School	ChIJebkD88oPZ0gRQHi91pH735w	school|point_of_interest|establishment	53.34796619999999	-6.2602113		Bachelors Way, North City, Dublin	school
58	The School of Jewellery Ireland	ChIJ04wGLssNZ0gR4LGLlJXAKng	school|point_of_interest|establishment	53.3409544	-6.2586932	False	19 Anne St S, Dublin 2, D02 YY83	school
59	Parnell Vocational School	ChIJX0iP34YOZ0gRP4ffcmKjve8	school|point_of_interest|establishment	53.3535245	-6.2615514		2-3 Parnell Square E, Rotunda, Dublin 1, D01 H3F2	school
