	name	place_id	types	geometry.location.lat	geometry.location.lng	opening_hours.open_now	formatted_address	main_type
0	No-H2O Car Wash Dawson Carpark	ChIJy_d6gZkOZ0gRxVhHnjvSt9Y	car_wash|point_of_interest|establishment	53.340283	-6.256617000000001	False		car_wash
1	Crystal Valet - Dawson Street	ChIJ_61suPAPZ0gRDsC0Cb2S7nI	car_wash|parking|point_of_interest|establishment	53.340128	-6.256913399999999	False		car_wash
2	Car valeting Crystalvalet Stephen's green	ChIJN9xxE80PZ0gRmgR84u8FBck	car_wash|point_of_interest|establishment	53.3439	-6.262027499999999			car_wash
3	Crystal Valet - RCSI St. Stephens Green	ChIJj7qjKZwOZ0gRnq7TbSnpWwE	car_wash|parking|point_of_interest|establishment	53.3392862	-6.262435899999999	False		car_wash
4	Crystal Valet - Trinity Street Dublin 2	ChIJeRgmJ0EPZ0gRmPVT8U_srNs	car_wash|parking|point_of_interest|establishment	53.34382179999999	-6.262444699999999	False		car_wash
5	Crystal Valet - St Stephens Green	ChIJUTQv5l0PZ0gRRFPQSpoPIlA	car_wash|parking|point_of_interest|establishment	53.3398649	-6.2632316	False		car_wash
6	Express Car Wash Drury Street	ChIJnxUD95wOZ0gRr0HVphQ-wmU	car_wash|point_of_interest|establishment	53.3416684	-6.263882299999999	False		car_wash
7	Jet Crystal Car Wash St Stephen's Green Shopping Centre	ChIJ36dG82kPZ0gRZtJ8wN5_yig	car_wash|point_of_interest|establishment	53.3398747	-6.263785100000001	False		car_wash
8	C.N.S VALETING	ChIJ8RX-6tUPZ0gRKuHxTQ_E6pQ	car_wash|point_of_interest|establishment	53.3498053	-6.260309700000001			car_wash
9	No-H2o--Red Long Term Car Park, Dublin Airport	ChIJ_adyR3YPZ0gRU4LX7WpfyIk	car_wash|parking|point_of_interest|establishment	53.3498053	-6.260309700000001	True		car_wash
10	Express Car Wash Arnotts Car Park	ChIJcY7dq78PZ0gRCsn95_HTk2I	car_wash|point_of_interest|establishment	53.3487891	-6.262352400000001	False		car_wash
11	AutoSpa	ChIJfwiNwqwPZ0gR-LhqbjQ3MvQ	car_wash|parking|car_repair|point_of_interest|establishment	53.35345959999999	-6.247492799999999	False		car_wash
12	No-H2o--Ilac Shopping Centre	ChIJz74I27IPZ0gRN392Moet0P4	car_wash|point_of_interest|establishment	53.34981149999999	-6.262724700000001	False		car_wash
13	Car Park Jervis Street | APCOA	ChIJtRUY8IIOZ0gRsMvOXLA6FHo	car_wash|parking|point_of_interest|establishment	53.3472386	-6.2661928	True		car_wash
14	Crystal Valet - Jervis Street	ChIJNTgcEOYPZ0gRGIlESmxinC4	car_wash|parking|point_of_interest|establishment	53.3473033	-6.266194200000001	False		car_wash
15	Provalet Dublin	ChIJI4Zb4MUPZ0gRO7eBTtofco0	car_wash|point_of_interest|establishment	53.3473878	-6.2661279			car_wash
16	Crystal Valet - The Spire Car Park	ChIJQ2Z8Z4YOZ0gRgV-dYNuSeSI	car_wash|parking|point_of_interest|establishment	53.3523111	-6.258429100000001	False		car_wash
17	Crystal Clean	ChIJ5SF_U4IOZ0gREDm_okGiqXU	car_wash|point_of_interest|establishment	53.3472142	-6.2664431	False		car_wash
18	Car Wash Jervis Shopping Centre Car Park level 2	ChIJ1enAVIwPZ0gRuWNz4jklbjY	car_wash|point_of_interest|establishment	53.34800609999999	-6.266233199999999	False		car_wash
19	No-H2O car wash	ChIJDflq4IMOZ0gRjGbypcUn0jw	car_wash|point_of_interest|establishment	53.350608	-6.26414	False		car_wash
20	Eco Car Wash	ChIJW_mMAoIOZ0gREDv76fvu_3o	car_wash|point_of_interest|establishment	53.3503823	-6.2687639	False	Parnell Car Park, Loftus Lane, Dublin 1	car_wash
21	Shine Xpress	ChIJfeucooEOZ0gREHQDSEBSUr0	car_wash|point_of_interest|establishment	53.3519205	-6.267019599999999	False	Dominick Ln, Rotunda, Dublin	car_wash
22	Posh wash	ChIJX-2hixMNZ0gRnMbjpo6_CHI	car_wash|point_of_interest|establishment	53.3254087	-6.2656471	False	Rathmines, Dublin, D06 W5Y2	car_wash
23	POSH WASH	ChIJbaPkA1oNZ0gRINBpkHJ42QQ	car_wash|point_of_interest|establishment	53.3252467	-6.2672107		Williams Park, Rathmines, Dublin	car_wash
24	Jet Crystal Car Wash Rathmines	ChIJKf2a5QIMZ0gRdahMAlvXGt8	car_wash|point_of_interest|establishment	53.3231891	-6.2639917	False	Swan Shopping Centre, Underground Carpark, Rathmines, Dublin	car_wash
25	GLANTOÍRÍ CAR WASH	ChIJu2Q-jo8NZ0gR2qHZBAI7I4s	car_wash|point_of_interest|establishment	53.3398426	-6.2861666	False	40 Marrowbone Ln, Saint Catherine's, Dublin 8, D08 DH95	car_wash
26	ALL VALET CAR VALETING Car Cleaning Centre	ChIJMaaalNUNZ0gR3N07gXXEgH4	car_wash|point_of_interest|establishment	53.36033500000001	-6.272823799999999	False	Phibsborough Rd, Phibsborough, Dublin 7	car_wash
27	CWS Carwashsolutions	ChIJA8Q7sGcOZ0gRRs89BBJrLnE	car_wash|laundry|car_repair|point_of_interest|establishment	53.365848	-6.247658	False	157 Richmond Rd, Ballybough, Dublin	car_wash
28	Samba Car Wash	ChIJKSVkxzIMZ0gRMKsjNMpBt_s	car_wash|point_of_interest|establishment	53.3540349	-6.286122499999999		8 Prussia St, Stoneybatter, Dublin 8	car_wash
29	Clontarf car wash	ChIJrcM4N_cPZ0gRVCuIBd0daJQ	car_wash|point_of_interest|establishment	53.364299	-6.225637	False	3, 5 Charlemont Rd, Clontarf, Dublin, D03 KR44	car_wash
30	Shine On Car Wash	ChIJXzDNtDIMZ0gRpTUzE029PiM	car_wash|point_of_interest|establishment	53.3549394	-6.2871101		27 Prussia St, Stoneybatter, Dublin 7, D07 PAF1	car_wash
31	Saram Car Wash	ChIJaaZbY-UNZ0gR-KSoN_tSIDU	car_wash|point_of_interest|establishment	53.3564279	-6.287139199999999	False	Park Shopping Center, 7 Prussia St, Arran Quay, Dublin, D07 TA4V	car_wash
32	Auto Spa	ChIJdZLAl0cMZ0gRdC0oe4oaZ-g	car_wash|point_of_interest|establishment	53.3416082	-6.297224399999999		Saint James' (part of Phoenix Park), Dublin 8	car_wash
33	No-H2O Car Wash Merrion Shopping Centre	ChIJ19uShdMOZ0gRmd4T8Ac1uEE	car_wash|point_of_interest|establishment	53.318771	-6.213626	False	Merrion Shopping Centre, Nutley Ln, Dublin Southside, Dublin, Dublin	car_wash
34	Best Cabra Car Wash	ChIJSd6D48kNZ0gRGEep46QKMDE	car_wash|point_of_interest|establishment	53.3605341	-6.2995206	False	Cabra West, Dublin	car_wash
35	Car wash Crystal clean	ChIJV9_e5n4NZ0gR9R-4JB7mauI	car_wash|point_of_interest|establishment	53.3729894	-6.284365999999999	False	Slaney Rd, Glasnevin, Dublin	car_wash
36	Car wash & valet	ChIJST4zdlANZ0gREsUMyfx5Df8	car_wash|point_of_interest|establishment	53.3729976	-6.2845952		stop 1509, Slaney Rd, Cabra East, Dublin	car_wash
37	Churchtown Carwash & Valet	ChIJZZ1XTPsLZ0gROe_9H6E92lo	car_wash|point_of_interest|establishment	53.30204130000001	-6.2665473	False	14 Braemor Rd, Newtown Little, Dublin 14	car_wash
38	Eco Car Wash - Artane Castle Shopping Centre	ChIJx242MUkPZ0gRuTP1q5s5AB4	car_wash|point_of_interest|establishment	53.38320419999999	-6.216910899999999	False	Beaumont, Dublin	car_wash
39	Car Wash	ChIJZyuL3MsPZ0gRPo8_LO5HlC4	car_wash|point_of_interest|establishment	53.3841966	-6.214572299999999		Beaumont, Dublin	car_wash
40	Elite Auto Clean	ChIJLYh0kl8OZ0gRDW-Hw_McTTc	car_wash|point_of_interest|establishment	53.3580292	-6.241027		Unit 1a Xavier Ave, North Dock, Dublin, D03 FH36	car_wash
41	Reel Car Care	ChIJf5yybF8OZ0gRhHFtXsakmWQ	car_wash|point_of_interest|establishment	53.35881209999999	-6.2384909		31 Leinster Ave, North Dock, Dublin, D03 V244	car_wash
42	tiger wash	ChIJdf-RXtwNZ0gRtNT28Q6z_lQ	car_wash|point_of_interest|establishment	53.37285199999999	-6.284815999999999		Cabra East, Dublin	car_wash
43	Posh Wash Ireland	ChIJ_3b6KN4JZ0gRZ6oZ_XxdNNY	car_wash|point_of_interest|establishment	53.3014466	-6.2461258	False	Windy Arbour, Dundrum Rd, Dundrum, Dublin	car_wash
44	Ben Dunne Carlisle Car Wash & Valeting	ChIJVzBawHkMZ0gRB7Xhm2ltIdk	car_wash|point_of_interest|establishment	53.314572	-6.3050023	False	52-54 Kimmage Rd W, Terenure, Kimmage, Dublin 12, D12 X379	car_wash
45	Wash World Eco Car Wash - Texaco Rathfarnham	ChIJtY8oXu0LZ0gRl1YIAOlWAOE	car_wash|point_of_interest|establishment	53.3006936	-6.2843236	True	Rathfarnham Rd, Rathfarnham, Dublin, D14 V2P4	car_wash
46	DH AUTOCARE Car Valeting & Detailing Services	ChIJqYyo1lVtZ0gReR9Kbju82Rg	car_wash|point_of_interest|establishment	53.3845196	-6.204314999999999	False	Mount Dillon Business Park, Brookville Park, Malahide Rd, Beaumont, Dublin 5	car_wash
47	Hand Car Wash	ChIJ6bsxoowLZ0gRjC58emrGBns	car_wash|point_of_interest|establishment	53.294355	-6.2779379		36 Nutgrove Ave, Rathfarnham, Dublin, D14 A0H7	car_wash
48	Professional Hand Car Valet	ChIJ39ymDekLZ0gRjGzIHSMLdnY	car_wash|point_of_interest|establishment	53.294353	-6.2782167	False	2A Nutgrove Avenue, Nutgrove, Dublin, D14 P7E2	car_wash
49	Crystal Clean Jet Carwash	ChIJQTqmlOcLZ0gRB4E_QyOeEzc	car_wash|point_of_interest|establishment	53.2919845	-6.2676539	False	Nutgrove Retail Park, Underground Car Park, Rathfarnham, Dublin	car_wash
50	Eco Car Wash Nutgrove	ChIJ_ajz8ucLZ0gRjsDNKyrFB8c	car_wash|point_of_interest|establishment	53.291625	-6.26838	False	Nutgrove shopping centre Car Park Nutgrove, Nutgrove Way, Rathfarnam, Co. Dublin	car_wash
51	Circle K Car Wash	ChIJd9usuSMOZ0gR4bNQP9ZwUbM	car_wash|point_of_interest|establishment	53.393564	-6.2478663		Santry, Dublin	car_wash
52	Eco Car Wash Rathfarnham Steam Wash	ChIJWawBl5ALZ0gRKIKd_wYXXn8	car_wash|point_of_interest|establishment	53.298258	-6.296343999999999	False	Rathfarnham Shopping Centre, Butterfield Ave, Templeogue Village, Dublin 14	car_wash
53	Circle K Car Wash	ChIJUcC_4AILZ0gRHqRgzSGIm_4	car_wash|point_of_interest|establishment	53.2906673	-6.2684448		Nutgrove Service Station, Nutgrove Way, Whitehall, Dublin 14	car_wash
54	Posh Wash Ireland	ChIJXw0I3pQPZ0gRyelCMXwDcfw	car_wash|point_of_interest|establishment	53.3804588	-6.1880107	False	Brookwood House, Harmonstown Rd, Donaghmede, Dublin	car_wash
55	Auto Beauty Club	ChIJ7a3C1ZwIZ0gRCAyNaFG-6DE	car_wash|point_of_interest|establishment	53.2956107	-6.2030303	False	The Old Merrion Garage, Stillorgan Rd, Stillorgan, Dublin	car_wash
56	D12 Carwash	ChIJqY3RiIEMZ0gR1KMhq9MOdGs	car_wash|point_of_interest|establishment	53.3115602	-6.3233792		Limekiln Ln Limekiln Ln, Perrystown, Dublin 12, D12 DY80	car_wash
57	Crystal Clean Frascati Shopping Centre	ChIJISfDG2wJZ0gRDZkeiPChOEk	car_wash|point_of_interest|establishment	53.3014755	-6.1826067	False	Frascati Rd, Blackrock, Dublin	car_wash
58	Circle K Car Wash	ChIJ70hkd2ALZ0gRDzf17ANDpvQ	car_wash|point_of_interest|establishment	53.2897303	-6.282968599999999		45 R822, Willbrook, Dublin	car_wash
59	No-H2O Blackrock Shopping Centre	ChIJswxfusYIZ0gR1cH_9IL7k6g	car_wash|point_of_interest|establishment	53.301883	-6.18019	False	Blackrock Shopping Centre, Frascati Rd, Blackrock,, underground carpark, Dublin	car_wash
