	name	place_id	types	geometry.location.lat	geometry.location.lng	opening_hours.open_now	formatted_address	main_type
0	ATM Easons	ChIJweB1irgPZ0gR2qWlPf67Ayg	atm|finance|point_of_interest|establishment	53.3425881	-6.2567695			atm
1	AIB ATM Grafton Street	ChIJzbP5dZsOZ0gRq2v9MYnpcjE	atm|finance|point_of_interest|establishment	53.3429146	-6.2593402	True		atm
2	ATM	ChIJS7gbdJsOZ0gRZiaCWM-SOVs	atm|finance|point_of_interest|establishment	53.3429647	-6.259633799999999	True		atm
3	Ulster Bank ATM (Grafton Street)	ChIJ129PcZsOZ0gRXbzrOzG92TE	atm|finance|point_of_interest|establishment	53.3431976	-6.259532599999999	True		atm
4	Permanent TSB	ChIJO9GP7ZgOZ0gReINDrzQiIxA	bank|atm|finance|point_of_interest|establishment	53.3411515	-6.2606356	False		atm
5	AIB ATM Wicklow Street	ChIJ0x6ueJsOZ0gRuROTXmiuXXA	atm|bank|finance|point_of_interest|establishment	53.3428248	-6.260220400000001	True		atm
6	Centra Wicklow Street	ChIJ21Kwf5sOZ0gRRityU_tCpcM	convenience_store|atm|finance|liquor_store|food|point_of_interest|store|establishment	53.3429078	-6.260538599999999	True		atm
7	Bank of Ireland	ChIJVcJVIJwOZ0gR-KSxxhn9PJI	atm|finance|point_of_interest|establishment	53.33850589999999	-6.255190199999999			atm
8	AIB ATM Baggot Street Lower	ChIJw4BX0ZkOZ0gRd4K4JbCtqHw	atm|bank|finance|point_of_interest|establishment	53.3383768	-6.254079200000001	True		atm
9	Ulster Bank (College Green)	ChIJF2EDXpsOZ0gR_BeqXsuLo8U	bank|atm|finance|point_of_interest|establishment	53.34413730000001	-6.260606000000001	False		atm
10	Ulster Bank ATM (College Green)	ChIJM2-tJP4PZ0gRNNzhs90CS4c	atm|finance|point_of_interest|establishment	53.3441902	-6.260578199999999	True		atm
11	AIB ATM Westland Row	ChIJR8WCA5EOZ0gRRv690PQJ6nk	atm|bank|finance|point_of_interest|establishment	53.34283180000001	-6.249769499999999	True		atm
12	Centra Westland Row	ChIJgcaZA5EOZ0gR2cmTaBYI8Ow	convenience_store|atm|meal_takeaway|finance|liquor_store|restaurant|food|point_of_interest|store|establishment	53.34283180000001	-6.249769399999999	True		atm
13	Ulster Bank ATM (Pearse Station)	ChIJg8WdqJEOZ0gReid_IiB2UD8	atm|finance|point_of_interest|establishment	53.34357749999999	-6.249459799999999	True		atm
14	ATM, Keoghs Cafe	ChIJAXjUOPcPZ0gRdJ5vz8rjw_k	atm|finance|point_of_interest|establishment	53.3441555	-6.262195099999999	True		atm
15	Bank of Ireland	ChIJmwOwhJoOZ0gR1mz8qp4jPBQ	atm|finance|point_of_interest|establishment	53.3450172	-6.260994399999999	False		atm
16	AIB ATM Stephens Street Dublin	ChIJH9RBNZwOZ0gRCfMDzf3wA0c	atm|bank|finance|point_of_interest|establishment	53.3411706	-6.263720799999999	True		atm
17	ATM	ChIJwZMZtIQOZ0gRJoSCMh9d-RU	atm|finance|point_of_interest|establishment	53.34585519999999	-6.259985599999999			atm
18	Ulster Bank ATM (Lower Baggot Street)	ChIJrWVtm5cOZ0gRhcMoNCg1xgk	atm|finance|point_of_interest|establishment	53.3374014	-6.251346799999999	True		atm
19	Ulster Bank (Baggot Street)	ChIJG4Tzc5sOZ0gRL-tWOjqrWMo	bank|atm|finance|point_of_interest|establishment	53.3374	-6.2512922	False		atm
20	AIB ATM South Great Georges Street	ChIJ3XQvAJ0OZ0gRTGaoJNmQ2Rw	atm|bank|finance|point_of_interest|establishment	53.342761	-6.264261299999999	True	Next to Dunnes Stores, South Great George's Street, Dublin	atm
21	Ulster Bank ATM Georges Quay	ChIJvf-IjY8OZ0gRkL-4yJtwZAk	atm|finance|point_of_interest|establishment	53.3471773	-6.253938499999999	True	George's Quay, Dublin	atm
22	Ulster Bank ATM (Earlsfort Terrace)	ChIJZWf-A8oPZ0gRJ_8En_KtPFU	atm|finance|point_of_interest|establishment	53.335807	-6.2571439	True	1A Earlsfort Terrace, Saint Kevin's, Dublin, D02 E922	atm
23	ATM inside Temple Bar	ChIJkZmFFywPZ0gRr112uArwH7M	atm|finance|point_of_interest|establishment	53.34548909999999	-6.2642167		47/48 downstairs, Temple Bar, Dublin, D02 N725	atm
24	AIB ATM Dame Street	ChIJ3a2_Pp0OZ0gRoqFfYS93PyQ	atm|bank|finance|point_of_interest|establishment	53.34390149999999	-6.2659972	True	AIB Bank Exterior Wall, 7-12 Dame Street, Opposite Olympia Theatre, Dublin 2, Dublin, D02 KX20	atm
25	Ulster Bank ATM (O'Connell Street)	ChIJWxPachEPZ0gRHlxCNaoMDaU	atm|finance|point_of_interest|establishment	53.34781899999999	-6.258991	True	2-4 O'Connell Street Lower, North City, Dublin, D01 RD34	atm
26	AIB ATM O'Connell Street	ChIJ21k0VoQOZ0gRHI1BVvsgxek	atm|bank|finance|point_of_interest|establishment	53.3480419	-6.2590886	True	The Grand Central, O'Connell Street Lower, North City, Dublin 1	atm
27	YourMoneyKiosk ATM	ChIJvSHobJIOZ0gRtMZKb6-s5IU	atm|finance|point_of_interest|establishment	53.3453439	-6.246266599999999		EUROSPAR Hanover St, Hanover Building, Hanover St East, Dublin 2	atm
28	Easy Cash ATM	ChIJ3xV0rpMOZ0gRcxWe-weJd3k	atm|finance|point_of_interest|establishment	53.34328199999999	-6.243980400000001		Centra, 97-98 Pearse St, Dublin, D02 WD34	atm
29	AIB ATM D.I.T Bishops Street	ChIJNZiTH54OZ0gR975NUAZcVJ0	atm|bank|finance|point_of_interest|establishment	53.3382611	-6.2674698	True	Dublin Institute of Technology, Bishops Street, Dublin 2, Dublin	atm
30	AIB ATM O'Connell Street Lower	ChIJze_yRYQOZ0gRvxD6X-kFkFc	atm|bank|finance|point_of_interest|establishment	53.3491751	-6.259564999999999	True	1 O'Connell Street Lower, Dublin 1, Dublin	atm
31	ATM Bank Of Ireland	ChIJy6ZX3Z8OZ0gR2O5DbsqhUXE	atm|finance|point_of_interest|establishment	53.33575339999999	-6.2653777	True	78-82 Camden Street Lower, Saint Kevin's, Dublin	atm
32	Ulster Bank ATM (Lr. Camden Street)	ChIJKeMYZzEPZ0gRdvE4lePvSGY	atm|finance|point_of_interest|establishment	53.3356346	-6.2655115	True	79-80 Camden Street Lower, Saint Kevin's, Dublin, D02 HA29	atm
33	Ulster Bank	ChIJqxPJqoMOZ0gR7azfKcQvmyc	atm|finance|point_of_interest|establishment	53.3480281	-6.2653693		125 Abbey Street Upper, North City, Dublin 1, D01 W3X5	atm
34	ATM	ChIJVXq3-YIOZ0gRsznj2CqMiOM	atm|finance|point_of_interest|establishment	53.3476823	-6.2660781		23 Jervis St, North City, Dublin 1	atm
35	ATM	ChIJS42_uicMZ0gRB4OvFcyoObA	atm|finance|point_of_interest|establishment	53.3431225	-6.2701162	True	8 Christchurch Pl, Wood Quay, Dublin, D08 RK00	atm
36	Ulster Bank ATM (Busárus)	ChIJf91AII8OZ0gR-fSAI2HBuYw	atm|finance|point_of_interest|establishment	53.3500487	-6.252203799999999	True	Busáras Central Bus Station, 1 Store St, Dublin, D01 P6V6	atm
37	AIB ATM Jervis Street S.C	ChIJtaidVIIOZ0gRLHba7kex8QE	atm|bank|finance|point_of_interest|establishment	53.3482472	-6.2656043	False	Jervis Street Shopping Centre, 125 Abbey Street Upper, North City, Entrance, Co. Dublin, D01 W3X5	atm
38	UB ATM Tesco	ChIJKZ6_-oUOZ0gRXKDn5RTdu2I	atm|finance|point_of_interest|establishment	53.35052169999999	-6.2562136	True	10 Talbot St, North City, Dublin 1, D01 EP40	atm
39	YourMoneyKiosk ATM	ChIJvZZVg44OZ0gRNRJWcGW4-Bk	atm|finance|point_of_interest|establishment	53.3494727	-6.248595799999999		SPAR, 1 George's Dock, North Dock, Dublin, D01 W213	atm
40	Bitcoin ATM - Boinnex	ChIJhdPf_OQPZ0gRXe4qJdyZkhg	atm|finance|point_of_interest|establishment	53.3445641	-6.2657664	True	17 Sycamore St, Temple Bar, Dublin, D02 WA09	atm
41	Bitcoin ATM - Boinnex	ChIJpaAWRmwPZ0gRtvFEQkrrR64	atm|finance|point_of_interest|establishment	53.3469719	-6.2622613	True	10 Bachelors Walk, North City, Dublin, D01 NP78	atm
42	Ulster Bank ATM (Jervis Shopping Centre)	ChIJj9r0QtgPZ0gRX30I1QZfYE8	atm|finance|point_of_interest|establishment	53.3482472	-6.2656043	False	Jervis Street Shopping Centre, Jervis St, North City, Dublin, D01 E6N4	atm
43	AIB ATM Gardiner Street Lower	ChIJf-ceUI8OZ0gRcrEv2s6CYMo	atm|bank|finance|point_of_interest|establishment	53.35059889999999	-6.254590599999999	True	External Wall, World Link House, Gardiner Street Lower, North City, Dublin	atm
44	AIB ATM O'Connell Street Upper	ChIJJ0pmF4QOZ0gRvHFGaJLRAKE	atm|bank|finance|point_of_interest|establishment	53.3501573	-6.2609292	True	Spar External Wall, 63-64 O'Connell Street Upper, Dublin, D01 X8C3	atm
45	AIB Talbot St	ChIJF9DeT48OZ0gRUqcy5f0xeoU	atm|finance|point_of_interest|establishment	53.3506318	-6.2545607		World Link House, Talbot St, North City, Dublin 1, D01 W9W2	atm
46	Ulster Bank ATM (Tesco Camden St.)	ChIJs5K4hO0PZ0gR3QjJTgIq8AM	atm|finance|point_of_interest|establishment	53.33412140000001	-6.265068299999999	True	41 Camden Street Lower, Saint Kevin's, Dublin 2, D02 FX46	atm
47	YourMoneyKiosk ATM	ChIJa_NihoIOZ0gRfw_yfp0OIHk	atm|finance|point_of_interest|establishment	53.3474973	-6.2681325	True	SPAR, Dublin 1, D01 Y6H2, 21-24 Capel St, North City, Dublin 1, D01 Y6H2	atm
48	Ulster Bank ATM (Maxol Ballsbridge)	ChIJ1UhIXaIPZ0gR8-EgZPv4j88	atm|finance|point_of_interest|establishment	53.3339661	-6.2458863	True	79C Mespil Rd, Ballsbridge, Dublin, D04 F2V1	atm
49	PTSB ATM	ChIJey1S3r0OZ0gRWF70gvgTwpA	atm|finance|point_of_interest|establishment	53.33401199999999	-6.244834	True	1-33 Baggot Street Upper, Dublin 4, D04 N1W9	atm
50	Spar ATM	ChIJSxc_SSEMZ0gRfMikCQZrA_s	atm|finance|point_of_interest|establishment	53.3390522	-6.2723042	True	Cathedral House, 50-52 Patrick St, Merchants Quay, Dublin 8, D08 AR29	atm
51	Bank Of Ireland ATM	ChIJWW_x1uwOZ0gRMXiu4-OHtrY	atm|finance|point_of_interest|establishment	53.3436787	-6.2392394		Bank of Ireland, Esat Building, 1 Grand Canal Qua, Grand Canal Dock, Dublin, D02 FF61	atm
52	AIB ATM Capel Street	ChIJh3c62CkMZ0gRKOz6dSge9p8	atm|bank|finance|point_of_interest|establishment	53.348423	-6.2688739	True	AIB Bank Exterior Wall, 126 Capel Street, Dublin 1, Dublin, D01 VW89	atm
53	YourMoneyKiosk ATM	ChIJBfknVowOZ0gRWxI0FWeulqw	atm|finance|point_of_interest|establishment	53.3494821	-6.2446514	True	SPAR, Custom House Quay, North Dock, Dublin	atm
54	YourMoneyKiosk ATM	ChIJ_RNgcKAOZ0gRHEVWwICAUoI	atm|finance|point_of_interest|establishment	53.3324839	-6.2645401		SPAR, Saint Kevin's, 52-58 Richmond St S, Dublin 2	atm
55	Ulster Bank ATM (Harcourt Green)	ChIJd_t1bB8PZ0gRzf2FhPRHWJ4	atm|finance|point_of_interest|establishment	53.331367	-6.2613563	True	Harcourt Green, Charlemont St, Dublin	atm
56	AIB ATM Harrington Street	ChIJTRXGeaAOZ0gROgiygWXOKfw	atm|bank|finance|point_of_interest|establishment	53.3323066	-6.2650339	False	AIB Bank External Wall, Harrington Street, Saint Kevin's, Dublin 8, Dublin	atm
57	UB ATM Centra	ChIJCR_8WoEOZ0gRtsGYQcQQNcs	atm|finance|point_of_interest|establishment	53.3512548	-6.263706399999999		North City, Dublin	atm
58	Bitcoin ATM Dublin - Bitcove	ChIJparwP_8PZ0gRm8HczMN70Mg	atm|finance|point_of_interest|establishment	53.3509075	-6.2655276	False	The Mobile shop, 189 Parnell St, Rotunda, Dublin 1, D01 P6X2	atm
59	UB ATM Tesco	ChIJEWJcT4EOZ0gRVFZtcAK9yX0	atm|finance|point_of_interest|establishment	53.351681	-6.2635646		168 Parnell St, Rotunda, Dublin 1, D01 R6K0	atm
