	name	place_id	types	geometry.location.lat	geometry.location.lng	opening_hours.open_now	formatted_address	main_type
0	Whitefriars Childcare Ltd	ChIJL9R4gSMMZ0gRAhpd73hXIno	school|point_of_interest|establishment	53.33874489999999	-6.276024400000001	False		school
1	St. Lukes Graveyard	ChIJJ-tN7SMMZ0gROebb2-_rlJg	school|point_of_interest|establishment	53.33849759999999	-6.275510999999999			school
2	St Brigid’s Catholic Primary School	ChIJ92Bh-SMMZ0gRt-F9IDO02_A	primary_school|school|point_of_interest|establishment	53.3389068	-6.2749714			school
3	Connolly's Children's Day Centre	ChIJfbvGYiQMZ0gRVK4kVFSPr7E	school|point_of_interest|establishment	53.3399042	-6.277467499999999			school
4	The Constant Knitter	ChIJXSIwqCYMZ0gR9A45XSPuXpc	school|point_of_interest|store|establishment	53.3398692	-6.274108	False		school
5	MyArt	ChIJY_GWmSMMZ0gRN26vAF_K0UA	school|point_of_interest|establishment	53.3378459	-6.2782439			school
6	Sinead's Dog Training School	ChIJObs5Ck8NZ0gRs-o517MrxbI	school|point_of_interest|establishment	53.3385439	-6.279302400000001			school
7	"Българско училище ""Азбука"" Дъблин"	ChIJCTMIkVsFZ0gRY68Mturs-Vk	school|point_of_interest|establishment	53.3367523	-6.2761308	False		school
8	Warrenmount Primary School	ChIJ-1e7rSMMZ0gRJ-DzVD4w6fI	school|point_of_interest|establishment	53.3367435	-6.276133100000001			school
9	Nest Childcare and Montessori	ChIJtbWaqSQMZ0gRlOAsWycmt-U	school|point_of_interest|establishment	53.3391403	-6.280443600000002	False		school
10	St. Patrick's Cathedral Grammar School	ChIJhwYhMSEMZ0gRpW3MaWasXpw	school|point_of_interest|establishment	53.33888	-6.2722008			school
11	Escola	ChIJjU-GHM0NZ0gRAO4abdSsdhM	school|point_of_interest|establishment	53.3416931	-6.275684399999999			school
12	Colegio Idiomas	ChIJ3fW_MyQMZ0gRdJr1lYDorRg	school|point_of_interest|establishment	53.3417152	-6.275704600000001			school
13	Francis Street School	ChIJ48fUJiQMZ0gRUbzq0Ev9aUA	primary_school|school|point_of_interest|establishment	53.3414075	-6.273488399999999			school
14	The Bridge Project	ChIJTe48SBoNZ0gRFtnUplwLl74	school|point_of_interest|establishment	53.3421978	-6.275580199999998	False		school
15	Childs Play	ChIJH67JNyIMZ0gRfyYNvFwRPRQ	school|point_of_interest|establishment	53.3360604	-6.2748591	False		school
16	Presentation Secondary School, Warrenmount	ChIJj0kt9iIMZ0gRPkbRxEeuTms	secondary_school|school|point_of_interest|establishment	53.33597719999999	-6.2778127			school
17	Lir Training and Education Ireland	ChIJ97HGHCUMZ0gRGrXSt2f5RFs	school|point_of_interest|establishment	53.3420147	-6.279172499999999			school
18	Muhammed School	ChIJA7pERiIMZ0gRV5X5996ahjY	school|point_of_interest|establishment	53.3357795	-6.275239900000001			school
19	Liberties College	ChIJkaQi3CYMZ0gRWXljlDmAxE8	school|point_of_interest|establishment	53.3406688	-6.2711535			school
20	Dublin Steiner School	ChIJv9bxDyUMZ0gRv3hGGLwH2-I	school|point_of_interest|establishment	53.34250489999999	-6.2789807	False	92 Meath St, The Liberties, Dublin 8, D08 YN15	school
21	District School	ChIJBR4bJzsMZ0gRtwYUnh8A0EA	school|point_of_interest|establishment	53.340826	-6.2830473		School Street Flats, 41 School St, The Liberties, Dublin 8	school
22	Scoil Treasa Naofa	ChIJC_GNrCIMZ0gRbRHxSlj85hA	school|point_of_interest|establishment	53.3345001	-6.279277899999999	False	Petrie Rd, Donore Avenue, Dublin 8	school
24	Irish Boarding Schools	ChIJc-IPYh8MZ0gRCe4WNOw35To	secondary_school|school|point_of_interest|establishment	53.3340427	-6.272765499999999		Lombard St W, Portobello, Dublin, D08 P8C4	school
25	St Endas Primary School	ChIJ2-lz-p0OZ0gRBZvq0u_C8uE	school|point_of_interest|establishment	53.340396	-6.266591		Whitefriar Pl, Dublin 8	school
26	School	ChIJ90_vjm4PZ0gRqbONQq4Z6FM	school|point_of_interest|establishment	53.3385873	-6.2663633		8 Peter Row, Dublin	school
27	Lighthouse Montessori School	ChIJX5_ZOyAMZ0gR9t7eoyCXtBw	school|point_of_interest|establishment	53.3353584	-6.2681358	False	6 Pleasants St, Saint Kevin's, Dublin 8, D08 Y335	school
28	Gouyang Primary School	ChIJaZd8EZ4OZ0gRbgjRa4PYqCs	school|point_of_interest|establishment	53.3389288	-6.2657735		34 Aungier St, Dublin 2, D02 HK75	school
29	St Catherine's National School	ChIJe9CcLBYMZ0gRbcGsTeBmAgE	school|point_of_interest|establishment	53.33322279999999	-6.283084199999999		8 Donore Ave, S Circular Rd, Dublin	school
30	City Montessori School	ChIJybVL9R8MZ0gRyccC_ovjYjQ	school|point_of_interest|establishment	53.334204	-6.267487	False	6 Grantham St, Saint Kevin's, Dublin 8, D08 FF80	school
31	Christian Brothers Secondary School	ChIJY0yM6x8MZ0gRaNcO_-4tkWs	secondary_school|school|point_of_interest|establishment	53.3335738	-6.2681098		Synge St, Saint Kevin's, Dublin	school
32	CBS James Street	ChIJz2GlbzkMZ0gRjAlaO-2MSNc	school|point_of_interest|establishment	53.3404405	-6.28931		8 Basin View, The Liberties, Dublin 8, D08 H2H9	school
33	The International School of English	ChIJN-SQhjAPZ0gRgH6DtHxXDgE	school|point_of_interest|establishment	53.3346539	-6.2655514	False	66 Camden Street Lower, Saint Kevin's, Dublin, D02 X201	school
34	High Schools International Limited	ChIJWeWJTZ0OZ0gRulImyVpELvU	school|point_of_interest|establishment	53.34489050000001	-6.2672447		Castle River House, Parliament St, Temple Bar, Dublin	school
35	Educate Together	ChIJb-OcipMOZ0gRvHaxmlFPuWM	school|secondary_school|point_of_interest|establishment	53.34602599999999	-6.2697663	False	Equity House, 16/17 Ormond Quay Upper, North City, Dublin, D07 H7DE	school
36	Bunscoil Sancta Maria (ERST) Primary School	ChIJY0yM6x8MZ0gRjYeXz_cfco8	school|point_of_interest|establishment	53.3333652	-6.2671031		Synge St, Saint Kevin's, Dublin	school
37	International School of Dublin	ChIJF_qvXsAIZ0gRdQQxcmsGssc	primary_school|school|point_of_interest|establishment	53.3332948	-6.2670762	False	Synge St, Saint Kevin's, Dublin, D08 PW64	school
38	School	ChIJkWe_SZwOZ0gRNdlhMGLRae4	school|point_of_interest|establishment	53.3413522	-6.2633015		33 William St S, Dublin 2, D02 NC58	school
39	St. James's Primary School	ChIJDY3IdDkMZ0gRdTTOp44hprw	school|point_of_interest|establishment	53.3403792	-6.2898805		Basin View, Ushers, Dublin	school
40	Career Guidance	ChIJTfk7CCUMZ0gRKw911qf8e7M	school|point_of_interest|establishment	53.3426157	-6.2783041		54 Thomas St, The Liberties, Dublin, D08 T653	school
41	Saint Catherines Primary School	ChIJXSkw1joMZ0gR5BNQjuv4REw	primary_school|school|point_of_interest|establishment	53.3415757	-6.2828168		15 Crane St, The Liberties, Dublin	school
42	AlFalah Islamic School of Dublin	ChIJUfavQsgNZ0gRo4r1wKv6rdg	school|point_of_interest|establishment	53.3344724	-6.2795584	False	Scoil Treasa Naofa, Petrie Rd, Saint Catherine's, Dublin, D08 XP02	school
43	Polish School of English in Dublin	ChIJTa6y8CUMZ0gRC_Oz_roigGw	school|point_of_interest|establishment	53.34442989999999	-6.2759762		28 Lower Bridge St, The Liberties, Dublin	school
44	Synge Street CBS school	ChIJL0fn-54OZ0gRrxRXhbEazK8	school|point_of_interest|establishment	53.3336795	-6.2682869		R110, Saint Kevin's, Dublin	school
45	Griffith Barracks Multi-Denominational School	ChIJU5y_gxcMZ0gR2zfKvZRtbp4	primary_school|school|point_of_interest|establishment	53.3311518	-6.2795953		The Old Guardhouse, S Circular Rd, Dublin, D08 KVY4	school
46	Kaplan School Building 2	ChIJt-A3HZ0OZ0gREqhTWBJl964	school|point_of_interest|establishment	53.3432903	-6.2645909		247 South Great George's Street, Dublin	school
48	Mater Dei National School	ChIJp-xDczkMZ0gR87kLOedhxWM	primary_school|school|point_of_interest|establishment	53.3408165	-6.290026699999999		Basin Lane, James Street, Dublin	school
49	School Of English	ChIJFeHaUCQNZ0gR_C1AuTDP-n8	school|point_of_interest|establishment	53.3475122	-6.2693943		4 Meetinghouse Ln, Smithfield, Dublin 7, D07 VY06	school
50	Presentation Primary School George’s Hill	ChIJRyjUoikMZ0gREJt45XTCg_I	primary_school|school|point_of_interest|establishment	53.3483489	-6.271549299999999		Halston St, Dublin 7	school
51	The School of Jewellery Ireland	ChIJ04wGLssNZ0gR4LGLlJXAKng	school|point_of_interest|establishment	53.3409544	-6.2586932	False	19 Anne St S, Dublin 2, D02 YY83	school
52	St Pauls CBS Secondary School	ChIJZfp7ACwMZ0gRKLYh_v1GL-w	school|point_of_interest|establishment	53.35019800000001	-6.2764808		Brunswick St N, Dublin, D07 VF57	school
53	The Internacional School Of English	ChIJf2kQ8aENZ0gRkx6VTwdxOBg	school|point_of_interest|establishment	53.3496951	-6.2694601		106 Capel St, Rotunda, Dublin 1, D01 WY40	school
54	EC Dublin English Language School	ChIJKSN_aJwOZ0gRGyMc52TGHlA	school|point_of_interest|establishment	53.3298508	-6.264691	False	La Touche House, 1 Grove Rd, Rathmines, Dublin 6, D06 F761	school
55	St Clare's Convent National School	ChIJP9sV2w8MZ0gRI7puukeYSyU	school|point_of_interest|establishment	53.326667	-6.2761052	False	Harold's Cross Rd, Rathmines, Dublin	school
56	Dublin 7 Educate Together National School	ChIJz1477CwMZ0gRvyG8ZqJLpBk	primary_school|school|point_of_interest|establishment	53.3518786	-6.277930700000001		Fitzwilliam Pl N, Arran Quay, Dublin 7	school
57	The Institute of Education	ChIJNZohgKIOZ0gRsyo41EDswHk	school|point_of_interest|establishment	53.33505290000001	-6.2555419		85 Leeson Street Lower, Dublin	school
58	School	ChIJebkD88oPZ0gRQHi91pH735w	school|point_of_interest|establishment	53.34796619999999	-6.2602113		Bachelors Way, North City, Dublin	school
59	C.U.S Secondary And Primary School	ChIJyZd7fJgOZ0gRaeNMgABehAA	school|point_of_interest|establishment	53.3354008	-6.2551191		Stable Ln, South-East Inner City, Dublin	school
