	name	place_id	types	geometry.location.lat	geometry.location.lng	opening_hours.open_now	formatted_address	main_type
0	Playdays	ChIJ_2z6UWAOZ0gRM-RGPyjQQ0w	school|point_of_interest|establishment	53.3590986	-6.2463794			school
1	St. Vincent's Girls' National School	ChIJU63MeIoOZ0gRJIReCi05RsU	primary_school|school|point_of_interest|establishment	53.35753200000001	-6.247147399999999	False		school
2	St Louises Day Care Centre	ChIJU63MeIoOZ0gROuuABV9jq80	school|point_of_interest|establishment	53.3571079	-6.247396999999999			school
3	St. Vincent's Infant Boys' School	ChIJU63MeIoOZ0gRKVrOesg_YR4	school|point_of_interest|establishment	53.3570709	-6.246926699999999			school
4	Skola Polska	ChIJjYJ8FBMPZ0gRsclLCCtsg8o	school|point_of_interest|establishment	53.3580926	-6.2505709			school
5	Learn a Lot Montessori	ChIJqecEHWIOZ0gRlB2LCoLWKH8	school|point_of_interest|establishment	53.3577041	-6.250405			school
6	O'Connell Secondary School	ChIJibOyH2IOZ0gRtWMz9SQQDas	secondary_school|school|point_of_interest|establishment	53.3582766	-6.250997099999999	False		school
7	Polska Szkoła PAK	ChIJUVlxw3UPZ0gRFZeu92O_7VE	school|point_of_interest|establishment	53.3577023	-6.2506267			school
8	O' Connell's Primary School	ChIJqYP4_LgPZ0gRbr55YOmmVbQ	school|point_of_interest|establishment	53.3579775	-6.250853299999999			school
9	Escuela	ChIJXT0kyBsPZ0gRCQ--vxB5reM	school|point_of_interest|establishment	53.3582253	-6.2509998	False		school
10	O'Connell CBS Primary School	ChIJqUEvEGIOZ0gRT_4mVoVCDHU	school|point_of_interest|establishment	53.35819949999999	-6.251071199999999			school
11	Daughters of Charity Child and Family Service	ChIJ19YXAmAOZ0gRcJBLpCnvOJU	school|point_of_interest|establishment	53.3566685	-6.2465459	False		school
12	Mud Island Community Garden	ChIJhaVsG2AOZ0gRlx1g7KTf8jE	school|point_of_interest|establishment	53.3574479	-6.243888900000001	False		school
13	St Columba’s school	ChIJXSSOShwPZ0gRT_JHhWjURCE	school|point_of_interest|establishment	53.3585356	-6.242273900000001			school
14	Smartedulink	ChIJBVOod2IOZ0gRNoEKo-A6qc8	school|university|point_of_interest|establishment	53.3569008	-6.2523192			school
15	Hyde & Seek Creche & Montessori	ChIJ6aJfD2QOZ0gRbRsZcx-7wvs	school|point_of_interest|establishment	53.362112	-6.2460584			school
17	St. Columba's National School	ChIJW_PBwl8OZ0gRXmztQ5HliiE	school|point_of_interest|establishment	53.3586365	-6.241667199999999			school
18	Martina Galvin	ChIJLUfdtGYOZ0gRT8cZjmNGA0g	school|point_of_interest|establishment	53.3623814	-6.249629			school
19	T2T Lounge	ChIJR5eZo4EOZ0gRpMVjRPdAQ7E	school|point_of_interest|establishment	53.354968	-6.245949299999999			school
20	St. Laurance O'Toole Special School	ChIJCW90-YoOZ0gRSmRKPrdeQnA	school|point_of_interest|establishment	53.3548757	-6.2457455		Aldborough Parade, North Dock, Dublin 1, D01 K3V8	school
22	Holy Child Pre-School	ChIJJy6krIkOZ0gR5JPUPBTSL4o	school|point_of_interest|establishment	53.3543859	-6.2527746		Lourdes Parish Schools, Sean Macdermott Street Lower, Mountjoy, Dublin, D01 F228	school
23	Delfin School	ChIJJ7BgeBQPZ0gRH8bNPekEtzo	school|point_of_interest|establishment	53.3570286	-6.2561524		26 Mountjoy Square E, Mountjoy, Dublin, D01 NX96	school
24	School of the g	ChIJS4I3BKEPZ0gRnJchdDU_4zg	school|point_of_interest|establishment	53.3598164	-6.2567648		6-8 Williams Place Lower, Ballybough, Dublin 1, D01 F8Y1	school
25	The Georgian Montessori Primary School	ChIJKwMeN30OZ0gRwSDT7I6jM90	school|point_of_interest|establishment	53.3580441	-6.2578138	False	40 Belvedere Pl, Mountjoy, Dublin, D01 W3W5	school
26	St Laurence O'Toole's CBS, Senior Boys' Primary School	ChIJCdFaaYsOZ0gRQ0sOkLfvQvc	school|point_of_interest|establishment	53.3528815	-6.2444631	False	1 Seville Pl, North Dock, Dublin	school
27	Scoil Naomh Lorcan O Tuathail	ChIJ3ftgXYsOZ0gRxN0E7A8pF7s	school|point_of_interest|establishment	53.35294349999999	-6.2439908		Seville Pl, North Dock, Dublin 1	school
28	St Joseph's Adolescent School	ChIJqSbOg5EPZ0gRw8fNY_bUCAs	school|point_of_interest|establishment	53.36487839999999	-6.2456454		Richmond Rd, Ballybough, Dublin	school
29	Stage School	ChIJjUtgIX0OZ0gRmBHbAsPdmt8	school|point_of_interest|establishment	53.3587853	-6.2587639		24 Belvedere Pl, Mountjoy, Dublin 1, D01 X033	school
30	Lourdes Parish Schools	ChIJ3SkujIgOZ0gRLALMG4Zv510	school|point_of_interest|establishment	53.3534277	-6.254723299999999		2-4 Gloucester Place Lower, Mountjoy, Dublin 1, D01 P7R9	school
31	Gardiner Street School	ChIJi2XDFX0OZ0gRfCJB7ntjD60	school|point_of_interest|establishment	53.357882	-6.25894	False	6 Belvedere Court, Mountjoy, Dublin	school
32	Rutland National School	ChIJuc2vjYgOZ0gRR0wQUD6YutU	school|point_of_interest|establishment	53.353384	-6.2548585		Sean Macdermott Street Lower, Mountjoy, Dublin	school
33	Special Primary School	ChIJQxYtp4wOZ0gR5TnuZWkyJnA	primary_school|school|point_of_interest|establishment	53.351585	-6.2428627		46 Seville Pl, North Dock, Dublin 1, D01 K227	school
34	St Marys National School	ChIJUTN1CVwOZ0gRVGRBgnYxeHQ	school|point_of_interest|establishment	53.36393839999999	-6.237903699999999		Windsor Ave, Fairview, Dublin	school
35	Celtic High School	ChIJnTGtj3wOZ0gRGsUq0ER-9_s	secondary_school|school|point_of_interest|establishment	53.3608765	-6.2606085		66 Dorset Street Lower, Dublin, D01 RR99	school
36	School	ChIJl2z5rdgPZ0gRF57smEbdZ1E	school|point_of_interest|establishment	53.3558697	-6.260476300000001		33 Gardiner Pl, Rotunda, Dublin, D01 W625	school
37	Academic Bridge - English School	ChIJ_aQTeYcOZ0gRvNNIGLewtJA	school|point_of_interest|establishment	53.3558601	-6.260481800000001	False	33 Gardiner Pl, Rotunda, Dublin 1, D01 W625	school
38	Nursery School	ChIJzbCKuYcOZ0gRle89HkuBh5A	school|point_of_interest|establishment	53.354622	-6.2595534		49-50 Hill St, Rotunda, Dublin 1, D01 H0X6	school
39	St Laurence O'Toole Girls & Boys national School	ChIJi9tGaYsOZ0gRA8TfkQXmKks	primary_school|school|point_of_interest|establishment	53.3509344	-6.241924		Seville Pl, St Laurence Pl E, North Wall, Dublin 1	school
40	An tAonad Reamhscoile	ChIJ-78OjYgOZ0gRBxnn29oDvh4	school|point_of_interest|establishment	53.3533507	-6.2545066		Gloucester Place Lower, Mountjoy, Dublin	school
41	Loretto Scoil Naisiunta	ChIJS8noCocOZ0gRSMNld-Lp1SM	school|point_of_interest|establishment	53.3549525	-6.2600444		36 Hill St, Rotunda, Dublin 1, D01 RW14	school
42	Central Model Senior School	ChIJk9HI1oUOZ0gR_bdtt5XD5KU	school|point_of_interest|establishment	53.3513517	-6.255823599999999		Marlborough St, North City, Dublin	school
43	Temple Street Hospital National School	ChIJ5xU_in0OZ0gR8pJ23CLENDg	school|point_of_interest|establishment	53.3568376	-6.262156	False	Temple St, Rotunda, Dublin	school
44	Billie Barry Stage School - ALL CLASSES	ChIJgfqtkFkPZ0gRle4LOFwbme4	school|point_of_interest|establishment	53.36614040000001	-6.2395331		Cymc Hall, Philipsburgh Ave, Fairview, Dublin	school
45	St Laurence O'Tooles National School	ChIJi9tGaYsOZ0gRec8PPgez5rg	school|point_of_interest|establishment	53.3501184	-6.2422707	False	Rainbow Park, Mariners Port, Dublin 1	school
46	Parnell Vocational School	ChIJX0iP34YOZ0gRP4ffcmKjve8	school|point_of_interest|establishment	53.3535245	-6.2615514		2-3 Parnell Square E, Rotunda, Dublin 1, D01 H3F2	school
47	Nagle-Rice Primary School	ChIJezGtpIAOZ0gRE-YOGpP-EAc	school|point_of_interest|establishment	53.3553273	-6.2642058		Frederick St N, Rotunda, Dublin	school
48	Jonix Pre School	ChIJgwjytoAOZ0gRcyQlEF8PkAI	school|point_of_interest|establishment	53.3549804	-6.264056200000001		28 Frederick St N, Rotunda, Dublin	school
49	New Quay School	ChIJwy66x4UOZ0gRBcblgD_Sjqs	school|point_of_interest|establishment	53.34987150000001	-6.2572852		Marlborough Pl, North City, Dublin	school
50	St Paul's Special School	ChIJwy66x4UOZ0gRmcI9O3XtSws	school|point_of_interest|establishment	53.34987150000001	-6.2572852		Marlborough Pl, North City, Dublin	school
51	City Quay National School	ChIJvQF60o8OZ0gRVRKU1YqfemA	school|point_of_interest|establishment	53.3466957	-6.2509863		Gloucester St S, Dublin Docklands, Dublin 2	school
52	St. Joseph's School for Children with Visual Impairment	ChIJ34SPgEEOZ0gRiCdxIF9PU0I	primary_school|school|point_of_interest|establishment	53.37088199999999	-6.246736299999999		Grace Park Rd, Ballybough, Dublin 9	school
53	St. Joseph's Co-Educational National School	ChIJ_d2VY_cOZ0gRMWvZ2kQa8D0	school|point_of_interest|establishment	53.354366	-6.2285321		126 E Wall Rd, East Wall, Dublin 3, D03 K220	school
54	St Mary's Primary School	ChIJzZylZoAOZ0gRTLBOQHt4LDg	school|point_of_interest|establishment	53.3547906	-6.267343200000001	False	Paradise Pl, Phibsborough, Dublin 7	school
55	St. Columba's School	ChIJty3XeXoOZ0gRn9JikHNkUv4	school|point_of_interest|establishment	53.3667842	-6.2635247		Iona Rd, Botanic, Dublin 9, D09 T9X0	school
56	St. Patrick's Boys' National School (Junior)	ChIJS6S5ZJYPZ0gR4SYmQkb6BZs	school|point_of_interest|establishment	53.3701693	-6.2582575		Millbourne Ave, Drumcondra, Dublin	school
57	School	ChIJebkD88oPZ0gRQHi91pH735w	school|point_of_interest|establishment	53.34796619999999	-6.2602113		Bachelors Way, North City, Dublin	school
58	The Mater School	ChIJNbl0v4gOZ0gR6gIY42xQk6E	school|point_of_interest|establishment	53.3592537	-6.2703333		15 St Vincent St N, Phibsborough, Dublin, D07 H318	school
59	Howth Road Mixed National School	ChIJxRKWVaoPZ0gRjRwtiJarCOI	school|point_of_interest|establishment	53.3641558	-6.2261969		Clontarf Rd, Clontarf, Dublin 3, D03 E166	school
