	name	place_id	types	geometry.location.lat	geometry.location.lng	opening_hours.open_now	formatted_address	main_type
0	Parkovanie	ChIJpdvkp-gPZ0gREnUtrUeucjQ	parking|point_of_interest|establishment	53.3517813	-6.259062500000001			parking
1	Moore Lane Car Park	ChIJF4GfroYOZ0gRukynOw9dgkM	parking|point_of_interest|establishment	53.35122620000001	-6.262169000000001			parking
2	Parking	ChIJmSQPrIYOZ0gRWpRPktkxO7w	parking|point_of_interest|establishment	53.351166	-6.262234999999999			parking
3	Crystal Valet - The Spire Car Park	ChIJQ2Z8Z4YOZ0gRgV-dYNuSeSI	car_wash|parking|point_of_interest|establishment	53.3523111	-6.258429100000001	False		parking
4	Q-PArk Clerys	ChIJnQZ_6_0PZ0gRYy7J-7TPxe0	parking|point_of_interest|establishment	53.352395	-6.258437999999999			parking
5	Q-Park The Spire	ChIJyx41XYYOZ0gR_QCfOzLvLo4	parking|storage|point_of_interest|establishment	53.352408	-6.258409	True		parking
6	Audi Airport Service	ChIJ1-m7ddURZ0gR0S8ka-BPBp4	parking|point_of_interest|establishment	53.3498053	-6.260309700000001	False		parking
7	No-H2o--Red Long Term Car Park, Dublin Airport	ChIJ_adyR3YPZ0gRU4LX7WpfyIk	car_wash|parking|point_of_interest|establishment	53.3498053	-6.260309700000001	False		parking
10	Best Car Parks Arnotts	ChIJebFSd4QOZ0gREV034JBJKeI	parking|point_of_interest|establishment	53.3487718	-6.262390099999999	False		parking
11	Ilac Shopping Centre Car Park	ChIJ09F7YoEOZ0gRekeF-kyOu_Y	parking|point_of_interest|establishment	53.3506872	-6.264877100000001	False		parking
13	2 Gardiner Street Middle Parking	ChIJ3fbYz4cOZ0gRI1lcJqFGDmM	parking|point_of_interest|establishment	53.3543383	-6.257193699999999			parking
14	QPark Car Park for Temple Street Hospital	ChIJre4vQ4cOZ0gR0DbNOe595mE	parking|point_of_interest|establishment	53.35489469999999	-6.2614779			parking
15	Park Rite	ChIJ51HdkYUOZ0gRXm0HO28n8UI	parking|point_of_interest|establishment	53.3496283	-6.2543191	False		parking
16	Parnell Parking King's Inns Street	ChIJMTMPhYEOZ0gR-gPwPxGoBts	parking|point_of_interest|establishment	53.3509749	-6.266659299999999			parking
17	Parkrite Parking	ChIJVV_jj4EOZ0gRlJQhiHJJPQU	parking|point_of_interest|establishment	53.3510028	-6.2667035	True		parking
18	Park Rite	ChIJPa87CIIOZ0gRa6WzULx8f0A	parking|point_of_interest|establishment	53.3510457	-6.267051299999999	True		parking
19	Park Rite Limited	ChIJ30KlahcMZ0gRrO4ev3rfWEg	parking|point_of_interest|establishment	53.3506239	-6.2672106			parking
20	Public Car Park	ChIJ0e2J9oEOZ0gRDhqNEFjlFMw	parking|point_of_interest|establishment	53.350659	-6.2682745		Loftus Ln, Rotunda, Dublin	parking
21	Jervis Shopping Centre Car Park	ChIJB9McFcEPZ0gRxeVyC5_uMmI	parking|point_of_interest|establishment	53.34786829999999	-6.2662575	False	23 Jervis St, North City, Dublin, D01 TH72	parking
22	Car Park Jervis Street | APCOA	ChIJtRUY8IIOZ0gRsMvOXLA6FHo	car_wash|parking|point_of_interest|establishment	53.3472386	-6.2661928	False	61-66 Jervis St, North City, Dublin, D01 X8C6	parking
23	Park Rite	ChIJx3TPUpsOZ0gRLvW6CkKJ4fk	parking|point_of_interest|establishment	53.3452432	-6.2612903	True	52-57 Fleet St, Temple Bar, Dublin, D02 A375	parking
24	Free parking	ChIJPYG4XIkOZ0gRrQueXlVsUgU	parking|point_of_interest|establishment	53.3525617	-6.2496782		Foley St, Mountjoy, Dublin 1, D01 WA07	parking
25	Park Rite City Quay	ChIJB8CHyo8OZ0gRRZ8qeSRQ0JY	parking|point_of_interest|establishment	53.34722259999999	-6.2513877	False	3-1 City Quay, Dublin Docklands, Dublin	parking
26	Euro Car Parks	ChIJYQX3ZX4OZ0gR5svQhAhPglE	parking|point_of_interest|establishment	53.3583936	-6.2649433	True	Mater Hospital, Eccles St, Dublin	parking
27	Munca	ChIJJ0hH01IPZ0gRg4hSOPSGP-U	parking|point_of_interest|establishment	53.3585848	-6.255208		541 N Circular Rd, Dublin 1, D01 XH76	parking
28	Coach Parking Area	ChIJod57iXoPZ0gRnJc0rH7_334	parking|point_of_interest|establishment	53.3518309	-6.2467565	True	43-49 Sheriff Street Lower, North Dock, Dublin 1, D01 T6C9	parking
29	Drury Street Car Park	ChIJVbzY9pwOZ0gR9jq4SHX5IQ8	parking|point_of_interest|establishment	53.34291	-6.263128999999999	False	36/37 Drury St, Dublin, D02 YK20	parking
30	Park Rite IFSC	ChIJEwHYyY0OZ0gRi7d4MhF60IE	parking|point_of_interest|establishment	53.348808	-6.246055999999999	False	Commons St, North Dock, Dublin, D01 DA34	parking
31	Brown Thomas Car Park	ChIJF61mfZwOZ0gR4t7UkAwyk_w	parking|point_of_interest|establishment	53.3426151	-6.2615808		49 Clarendon St, Dublin, D02 AC89	parking
32	Croke Park Car Park	ChIJAfSDUmIOZ0gRiwVQ_iAq62Q	parking|point_of_interest|establishment	53.3592658	-6.2530639		Ballybough, Dublin 3, D03 HP52	parking
33	Parking dublin	ChIJJWgbmCsPZ0gRECXTHAelpvQ	parking|point_of_interest|establishment	53.342411	-6.262686		Dublin	parking
34	Parking	ChIJxTPbGikMZ0gRjwp6U02h-Hs	parking|point_of_interest|establishment	53.34822819999999	-6.274995199999999		28 Mary's Ln, Dublin 7, D07 Y76T	parking
35	Smithfield Lofts Car Park	ChIJK31wUSkMZ0gR-7MNfxui7Hg	parking|point_of_interest|establishment	53.3496128	-6.275821		Bow St, Arran Quay, Dublin	parking
36	Car Park	ChIJKRpfMgQNZ0gRAPx5ldcIiH8	parking|point_of_interest|establishment	53.3433886	-6.2691655		Wood Quay, Dublin	parking
37	Spencer Hotel car park	ChIJwxO7ExMPZ0gR1GCX40urOrk	parking|point_of_interest|establishment	53.3484722	-6.2445279		Unnamed Road, North Dock, Dublin	parking
38	Park Rite Drury Street	ChIJq5PotJ0OZ0gRhC6mURWMhes	parking|point_of_interest|establishment	53.34151439999999	-6.263956299999999	True	59-62 Drury St, Dublin 2, D02 V261	parking
39	Q-Park Setanta	ChIJub5aT5oOZ0gRik4O3OL05qU	parking|storage|point_of_interest|establishment	53.34153509999999	-6.2557449	True	1 Setanta Pl, Dublin, D02 V968	parking
40	Spencer Hotel Car Park	ChIJ______AOZ0gRrXUdadMfKTw	parking|point_of_interest|establishment	53.3484647	-6.2445192		Alderman Way, North Dock, Dublin	parking
41	Q-Park Christchurch	ChIJb9iPoycMZ0gR26M-RpUpAt8	parking|storage|point_of_interest|establishment	53.34301749999999	-6.270018500000001	True	2 Werburgh St, Dublin, D08 X981	parking
42	Trinity College Visitors Car Park Cumberland Street South	ChIJd_hYnJEOZ0gROaluNDUpdRY	parking|point_of_interest|establishment	53.34365	-6.24794		Dublin	parking
43	2 Werburgh St Parking	ChIJv2X_oCcMZ0gRbEXWQRX13x4	parking|point_of_interest|establishment	53.34244409999999	-6.269619199999999	True	2 Werburgh St, Dublin, D08 WTC0	parking
44	NCPS Pay Parking Bride Street	ChIJ36L5oCcMZ0gRST_NkjQp_8Q	parking|point_of_interest|establishment	53.3424236	-6.2696314	True	Werburgh St, Dublin Southside, Dublin	parking
45	A&L Goodbody Car Park	ChIJ36EJG10PZ0gRF92x8p6EMaM	parking|point_of_interest|establishment	53.348432	-6.2420914		North Dock, Dublin	parking
46	Q-Park Dawson Street	ChIJ87AMK5oOZ0gRQtjT6yAEC7Q	parking|storage|point_of_interest|establishment	53.340279	-6.255961	True	Dawson Street Car Park, School House Ln E, Dublin 2, D02 WF63	parking
47	15-21 Usher's Quay Parking	ChIJ7-rdaS8MZ0gRGjSQ_OriZZY	parking|point_of_interest|establishment	53.3453143	-6.276431499999999		15-21 Usher's Quay, Usher's Quay, Dublin, D08 K778	parking
48	Stephen’s Green Q Park	ChIJc7xbstwPZ0gRDfAJpU2YcC8	parking|point_of_interest|establishment	53.3398285	-6.264140599999999		12A Bow Ln E, Dublin 2, D02 V126	parking
49	Park Rite	ChIJ44gmiC4MZ0gRYZKUhyhJ7lg	parking|point_of_interest|establishment	53.3490487	-6.2795219	False	Smithfield Market Car Park, Queen St, Dublin, D07 NX33	parking
50	Q-Park St Stephens Green	ChIJ3SWqmp4OZ0gRVQJRuVgz8C8	parking|storage|point_of_interest|establishment	53.33928	-6.262508	True	Glover's Alley, Dublin 2, D02 TW61	parking
51	Q-Park Four Courts	ChIJ_SEaaS8MZ0gRLVCk3fiU7fw	parking|storage|point_of_interest|establishment	53.345208	-6.27788	False	15-21 Usher's Quay, Usher's Quay, Dublin 8, D08 VP9C	parking
52	CCD & PwC Underground Car Park	ChIJbxE_V_IOZ0gR2r-2kq5qQik	parking|point_of_interest|establishment	53.34975	-6.2386471		Spencer Dock, N Wall Quay, North Dock, Dublin	parking
53	Kellys Yard Euro CarPark	ChIJO7OkLvsNZ0gRgQMGpAQ8Deg	parking|point_of_interest|establishment	53.3612961	-6.273725		Phibsborough, Dublin 7	parking
54	Oliver Bond Street Parking	ChIJEe0jhCUMZ0gR0TuW6FYEt68	parking|point_of_interest|establishment	53.3441908	-6.278012599999999	True	Oliver Bond St, Usher's Quay, Dublin	parking
55	Euro Car Parks Convention Centre Dublin Car Park	ChIJM6zU4PIOZ0gRCMK1CLxWN2g	parking|point_of_interest|establishment	53.3482315	-6.238840499999999	False	1 Mayor Street Upper, North Wall, Dublin 1, D01 DR94	parking
56	R801 Parking	ChIJuQxHkvIOZ0gRn5hveIhBsaE	parking|point_of_interest|establishment	53.3477457	-6.238247899999999		R801, Dublin, D01 X9R7	parking
57	1 Connaught St Parking	ChIJHfQ-FdYNZ0gR3rdBrckrwQE	parking|point_of_interest|establishment	53.3622813	-6.2738542		1 Connaught St, Cabra East, Dublin, D07 E953	parking
58	Best Car Parks	ChIJU4NplM8PZ0gR9FAvk0jR8Xc	parking|point_of_interest|establishment	53.34471370000001	-6.2397408	True	Hibernian Rd, Dublin Docklands, Dublin	parking
59	13-20 Clarence Place Great Parking	ChIJyxp0dpMOZ0gRJJaff2CpRH4	parking|point_of_interest|establishment	53.341986	-6.2428034		13-20 Clarence Place Great, Dublin	parking
